{
  "$schema": "./FrontendBundleBudget.schema.json",
  "schemaVersion": 3,
  "entryDocument": "Frontend/dist/index.html",
  "manifest": "Frontend/dist/.vite/manifest.json",
  "groups": [
    {
      "id": "bootstrap",
      "includeEntryDocument": true,
      "roots": ["index.html"],
      "requiredAssets": [{ "extension": ".woff2", "minimumCount": 1 }],
      "limits": {
        "resourceCount": 9,
        "identityBytes": 820224,
        "gzipBytes": 325000,
        "brotliBytes": 305500
      }
    },
    {
      "id": "authenticated-main",
      "extends": ["bootstrap"],
      "roots": ["App"],
      "limits": {
        "resourceCount": 17,
        "identityBytes": 1630000,
        "gzipBytes": 560000,
        "brotliBytes": 515000
      }
    },
    {
      "id": "web-settings",
      "extends": ["authenticated-main"],
      "roots": ["src/features/settings/SettingsOverlay.tsx"],
      "limits": {
        "resourceCount": 22,
        "identityBytes": 1830000,
        "gzipBytes": 615000,
        "brotliBytes": 565000
      }
    },
    {
      "id": "desktop-settings",
      "extends": ["bootstrap"],
      "roots": ["src/app/DesktopSettingsSurface.tsx"],
      "limits": {
        "resourceCount": 19,
        "identityBytes": 1462000,
        "gzipBytes": 510000,
        "brotliBytes": 475000
      }
    }
  ]
}
